[
  {
    "question_id": "SYN-Q01",
    "expected": {
      "status": "answered",
      "columns": [
        "display_name"
      ],
      "rows": [
        [
          "Fiktiver See"
        ]
      ],
      "units": {},
      "caveats": [
        "synthetic_fixture_only",
        "benchmark_subset_only"
      ],
      "evidence_ids": [],
      "explanation_de": "Synthetische Testantwort; keine Aussage über reale Veranstaltungen."
    },
    "oracle_sql": "SELECT display_name FROM event WHERE race_id='SYN-1'",
    "ordered": false,
    "tolerances": {},
    "evidence_alternatives": [],
    "prohibited_claims": [
      "national_representativeness",
      "causal_effect"
    ],
    "reviewer": "synthetic_fixture_programmatic_crosscheck"
  },
  {
    "question_id": "SYN-Q02",
    "expected": {
      "status": "answered",
      "columns": [
        "event_year"
      ],
      "rows": [
        [
          2021
        ],
        [
          2023
        ]
      ],
      "units": {},
      "caveats": [
        "synthetic_fixture_only",
        "benchmark_subset_only"
      ],
      "evidence_ids": [],
      "explanation_de": "Synthetische Testantwort; keine Aussage über reale Veranstaltungen."
    },
    "oracle_sql": "SELECT event_year FROM event_year WHERE race_id='SYN-3' ORDER BY event_year",
    "ordered": false,
    "tolerances": {},
    "evidence_alternatives": [],
    "prohibited_claims": [
      "national_representativeness",
      "causal_effect"
    ],
    "reviewer": "synthetic_fixture_programmatic_crosscheck"
  },
  {
    "question_id": "SYN-Q03",
    "expected": {
      "status": "answered",
      "columns": [
        "scheduled",
        "held"
      ],
      "rows": [
        [
          true,
          false
        ]
      ],
      "units": {},
      "caveats": [
        "synthetic_fixture_only",
        "benchmark_subset_only"
      ],
      "evidence_ids": [],
      "explanation_de": "Synthetische Testantwort; keine Aussage über reale Veranstaltungen."
    },
    "oracle_sql": "SELECT scheduled, held FROM event_year WHERE race_id='SYN-2' AND event_year=2021",
    "ordered": false,
    "tolerances": {},
    "evidence_alternatives": [],
    "prohibited_claims": [
      "national_representativeness",
      "causal_effect"
    ],
    "reviewer": "synthetic_fixture_programmatic_crosscheck"
  },
  {
    "question_id": "SYN-Q04",
    "expected": {
      "status": "answered",
      "columns": [
        "race_id"
      ],
      "rows": [
        [
          "SYN-4"
        ]
      ],
      "units": {},
      "caveats": [
        "synthetic_fixture_only",
        "benchmark_subset_only"
      ],
      "evidence_ids": [],
      "explanation_de": "Synthetische Testantwort; keine Aussage über reale Veranstaltungen."
    },
    "oracle_sql": "SELECT race_id FROM event_year WHERE event_year=2023 AND abnormal_termination IS TRUE",
    "ordered": false,
    "tolerances": {},
    "evidence_alternatives": [],
    "prohibited_claims": [
      "national_representativeness",
      "causal_effect"
    ],
    "reviewer": "synthetic_fixture_programmatic_crosscheck"
  },
  {
    "question_id": "SYN-Q05",
    "expected": {
      "status": "answered",
      "columns": [
        "observation_count"
      ],
      "rows": [
        [
          11
        ]
      ],
      "units": {},
      "caveats": [
        "synthetic_fixture_only",
        "benchmark_subset_only"
      ],
      "evidence_ids": [],
      "explanation_de": "Synthetische Testantwort; keine Aussage über reale Veranstaltungen."
    },
    "oracle_sql": "SELECT COUNT(*) AS observation_count FROM event_year",
    "ordered": false,
    "tolerances": {},
    "evidence_alternatives": [],
    "prohibited_claims": [
      "national_representativeness",
      "causal_effect"
    ],
    "reviewer": "synthetic_fixture_programmatic_crosscheck"
  },
  {
    "question_id": "SYN-Q06",
    "expected": {
      "status": "answered",
      "columns": [
        "state_code",
        "identities"
      ],
      "rows": [
        [
          "DE-SH",
          2
        ],
        [
          "DE-BW",
          2
        ]
      ],
      "units": {},
      "caveats": [
        "synthetic_fixture_only",
        "benchmark_subset_only"
      ],
      "evidence_ids": [],
      "explanation_de": "Synthetische Testantwort; keine Aussage über reale Veranstaltungen."
    },
    "oracle_sql": "SELECT state_code, COUNT(DISTINCT race_id) AS identities FROM event_year GROUP BY state_code",
    "ordered": false,
    "tolerances": {},
    "evidence_alternatives": [],
    "prohibited_claims": [
      "national_representativeness",
      "causal_effect"
    ],
    "reviewer": "synthetic_fixture_programmatic_crosscheck"
  },
  {
    "question_id": "SYN-Q07",
    "expected": {
      "status": "answered",
      "columns": [
        "event_year",
        "listed_count"
      ],
      "rows": [
        [
          2021,
          3
        ],
        [
          2022,
          3
        ],
        [
          2023,
          4
        ]
      ],
      "units": {},
      "caveats": [
        "synthetic_fixture_only",
        "benchmark_subset_only"
      ],
      "evidence_ids": [],
      "explanation_de": "Synthetische Testantwort; keine Aussage über reale Veranstaltungen."
    },
    "oracle_sql": "SELECT event_year, COUNT(*) AS listed_count FROM event_year WHERE scheduled IS TRUE GROUP BY event_year",
    "ordered": false,
    "tolerances": {},
    "evidence_alternatives": [],
    "prohibited_claims": [
      "national_representativeness",
      "causal_effect"
    ],
    "reviewer": "synthetic_fixture_programmatic_crosscheck"
  },
  {
    "question_id": "SYN-Q08",
    "expected": {
      "status": "answered",
      "columns": [
        "state_code",
        "observation_count"
      ],
      "rows": [
        [
          "DE-BW",
          6
        ]
      ],
      "units": {},
      "caveats": [
        "synthetic_fixture_only",
        "benchmark_subset_only"
      ],
      "evidence_ids": [],
      "explanation_de": "Synthetische Testantwort; keine Aussage über reale Veranstaltungen."
    },
    "oracle_sql": "SELECT state_code, COUNT(*) AS observation_count FROM event_year GROUP BY state_code HAVING COUNT(*)>5",
    "ordered": false,
    "tolerances": {},
    "evidence_alternatives": [],
    "prohibited_claims": [
      "national_representativeness",
      "causal_effect"
    ],
    "reviewer": "synthetic_fixture_programmatic_crosscheck"
  },
  {
    "question_id": "SYN-Q09",
    "expected": {
      "status": "answered",
      "columns": [
        "difference"
      ],
      "rows": [
        [
          -1
        ]
      ],
      "units": {},
      "caveats": [
        "synthetic_fixture_only",
        "benchmark_subset_only"
      ],
      "evidence_ids": [],
      "explanation_de": "Synthetische Testantwort; keine Aussage über reale Veranstaltungen."
    },
    "oracle_sql": "SELECT SUM(CASE WHEN event_year=2022 THEN 1 ELSE 0 END)-SUM(CASE WHEN event_year=2021 THEN 1 ELSE 0 END) AS difference FROM event_year",
    "ordered": false,
    "tolerances": {},
    "evidence_alternatives": [],
    "prohibited_claims": [
      "national_representativeness",
      "causal_effect"
    ],
    "reviewer": "synthetic_fixture_programmatic_crosscheck"
  },
  {
    "question_id": "SYN-Q10",
    "expected": {
      "status": "answered",
      "columns": [
        "event_year"
      ],
      "rows": [
        [
          2021
        ],
        [
          2023
        ]
      ],
      "units": {},
      "caveats": [
        "synthetic_fixture_only",
        "benchmark_subset_only"
      ],
      "evidence_ids": [],
      "explanation_de": "Synthetische Testantwort; keine Aussage über reale Veranstaltungen."
    },
    "oracle_sql": "SELECT event_year FROM event_year WHERE race_id='SYN-1' AND held IS TRUE",
    "ordered": false,
    "tolerances": {},
    "evidence_alternatives": [],
    "prohibited_claims": [
      "national_representativeness",
      "causal_effect"
    ],
    "reviewer": "synthetic_fixture_programmatic_crosscheck"
  },
  {
    "question_id": "SYN-Q11",
    "expected": {
      "status": "answered",
      "columns": [
        "race_id"
      ],
      "rows": [
        [
          "SYN-1"
        ],
        [
          "SYN-2"
        ],
        [
          "SYN-3"
        ],
        [
          "SYN-4"
        ]
      ],
      "units": {},
      "caveats": [
        "synthetic_fixture_only",
        "benchmark_subset_only"
      ],
      "evidence_ids": [],
      "explanation_de": "Synthetische Testantwort; keine Aussage über reale Veranstaltungen."
    },
    "oracle_sql": "SELECT a.race_id FROM event_year a JOIN event_year b ON a.race_id=b.race_id WHERE a.event_year=2021 AND b.event_year=2023",
    "ordered": false,
    "tolerances": {},
    "evidence_alternatives": [],
    "prohibited_claims": [
      "national_representativeness",
      "causal_effect"
    ],
    "reviewer": "synthetic_fixture_programmatic_crosscheck"
  },
  {
    "question_id": "SYN-Q12",
    "expected": {
      "status": "answered",
      "columns": [
        "race_id",
        "first_year",
        "last_year"
      ],
      "rows": [
        [
          "SYN-3",
          2021,
          2023
        ],
        [
          "SYN-2",
          2021,
          2023
        ],
        [
          "SYN-4",
          2021,
          2023
        ],
        [
          "SYN-1",
          2021,
          2023
        ]
      ],
      "units": {},
      "caveats": [
        "synthetic_fixture_only",